Sheet: README
A1: Homeschooling Checklist README
B3: Purpose
C4: Homeschooling students can have radically different schedules from their schooled counterparts. While students in school have all of their classes and clubs scheduled for them, many homeschooled students keep track of their own scheduling of work.
C5: This project is a sample student checklist for tracking progress and dashboard for displaying progress.
B6: Sheets
C7: Sample Student Checklist – where the student or teacher keeps track of the student progress in different subjects.
C8: Sample Dashboard – Displays the student progress at a glance.
C9: Grading – A sample grading policy based on precent of the goals that were completed.
B10: Checklist Columns
C11: Grade | D11: Automatically Calculated from %Done column
C12: %Done | D12: Automatically Calculated from Needed and Total columns
C13: Subject and Detail | D13: Each Subject may have several associated Detail Rows for different class activities.
C14: Length | D14: What counts as 1 lesson
C15: Needed | D15: How many of each detail the student should complete for the quarter
C16: Wk | D16: How much of each Detail the student completed in that week of the quarter
C17: Tot | D17: How many items done this quarter
C18: More | D18: How many more (of Needed) remain undone
C19: Done | D19: Whether the student has finished all items in this row

Sheet: Sample Student Checklist
A1: Sample Student Checklist | Q1: of:=TODAY() -> 2023-03-30
B2: 12th Grade, 1st Quarter | Q2: Student Name
B4: Grade | C4: %Done | D4: Subject | E4: Details | F4: Length | G4: Need | H4: W1 | I4: W2 | J4: W3 | K4: W4 | L4: W5 | M4: W6 | N4: W7 | O4: W8 | P4: W9 | Q4: W10 | R4: Total | S4: More | T4: Done
B5: of:=IF([.C5] < 80; "F";IF([.C5]>89; IF([.C5]>92;"A";"A-");IF([.C5]>82;"B";"B-"))) -> A | C5: of:=ROUND([.R5]*100/[.G5];0) -> 100 | D5: History | E5: Khan Academy World History | F5: 1 quiz | G5: 12 | H5: 1 | I5: 2 | J5: 1 | K5: 3 | L5: 5 | M5: 0 | N5: 0 | O5: 0 | P5: 0 | Q5: 0 | R5: of:=SUM([.H5:.Q5]) -> 12 | S5: of:=IF([.G5]-[.R5]>0; [.G5]-[.R5]; 0) -> 0 | T5: of:=IF([.S5]<1; "DONE";" " ) -> DONE
B6: of:=IF([.C6] < 80; "F";IF([.C6]>89; IF([.C6]>92;"A";"A-");IF([.C6]>82;"B";"B-"))) -> A | C6: of:=ROUND([.R6]*100/[.G6];0) -> 100 | D6: Psychology | E6: Discussion | F6: 1 talk | G6: 10 | H6: 0 | I6: 0 | J6: 0 | K6: 1 | L6: 0 | M6: 0 | N6: 0 | O6: 0 | P6: 0 | Q6: 0 | R6: of:=SUM([.H6:.Q6]) -> 1 | S6: of:=IF([.G6]-[.R6]>0; [.G6]-[.R6]; 0) -> 0 | T6: of:=IF([.S6]<1; "DONE";" " ) -> DONE
B7: of:=IF([.C7] < 80; "F";IF([.C7]>89; IF([.C7]>92;"A";"A-");IF([.C7]>82;"B";"B-"))) -> A | C7: of:=ROUND([.R7]*100/[.G7];0) -> 100 | D7: Spanish | E7: Lesson | F7: 20 min | G7: 10 | H7: 0 | I7: 1 | J7: 1 | K7: 1 | L7: 1 | M7: 1 | N7: 0 | O7: 0 | P7: 0 | Q7: 0 | R7: of:=SUM([.H7:.Q7]) -> 5 | S7: of:=IF([.G7]-[.R7]>0; [.G7]-[.R7]; 0) -> 0 | T7: of:=IF([.S7]<1; "DONE";" " ) -> DONE
B8: of:=IF([.C8] < 80; "F";IF([.C8]>89; IF([.C8]>92;"A";"A-");IF([.C8]>82;"B";"B-"))) -> A | C8: of:=ROUND([.R8]*100/[.G8];0) -> 100 | D8: Spanish | E8: Translation | F8: 1 chapter | G8: 10 | H8: 0 | I8: 1 | J8: 1 | K8: 1 | L8: 1 | M8: 1 | N8: 0 | O8: 0 | P8: 0 | Q8: 0 | R8: of:=SUM([.H8:.Q8]) -> 5 | S8: of:=IF([.G8]-[.R8]>0; [.G8]-[.R8]; 0) -> 0 | T8: of:=IF([.S8]<1; "DONE";" " ) -> DONE
B9: of:=IF([.C9] < 80; "F";IF([.C9]>89; IF([.C9]>92;"A";"A-");IF([.C9]>82;"B";"B-"))) -> A | C9: of:=ROUND([.R9]*100/[.G9];0) -> 100 | D9: Spanish | E9: Quiz | F9: 20 min | G9: 20 | H9: 0 | I9: 0 | J9: 2 | K9: 1 | L9: 1 | M9: 1 | N9: 0 | O9: 0 | P9: 0 | Q9: 0 | R9: of:=SUM([.H9:.Q9]) -> 5 | S9: of:=IF([.G9]-[.R9]>0; [.G9]-[.R9]; 0) -> 0 | T9: of:=IF([.S9]<1; "DONE";" " ) -> DONE
B10: of:=IF([.C10] < 80; "F";IF([.C10]>89; IF([.C10]>92;"A";"A-");IF([.C10]>82;"B";"B-"))) -> A | C10: of:=ROUND([.R10]*100/[.G10];0) -> 100 | D10: Bio | E10: AP Test Prep | F10: lesson | G10: 10 | H10: 1 | I10: 1 | J10: 0 | K10: 1 | L10: 1 | M10: 1 | N10: 2 | O10: 0 | P10: 0 | Q10: 0 | R10: of:=SUM([.H10:.Q10]) -> 8 | S10: of:=IF([.G10]-[.R10]>0; [.G10]-[.R10]; 0) -> 0 | T10: of:=IF([.S10]<1; "DONE";" " ) -> DONE
B11: of:=IF([.C11] < 80; "F";IF([.C11]>89; IF([.C11]>92;"A";"A-");IF([.C11]>82;"B";"B-"))) -> A | C11: of:=ROUND([.R11]*100/[.G11];0) -> 100 | D11: History | E11: AP Test Prep | F11: lesson | G11: 10 | H11: 1 | I11: 0 | J11: 2 | K11: 0 | L11: 1 | M11: 1 | N11: 1 | O11: 3 | P11: 0 | Q11: 0 | R11: of:=SUM([.H11:.Q11]) -> 10 | S11: of:=IF([.G11]-[.R11]>0; [.G11]-[.R11]; 0) -> 0 | T11: of:=IF([.S11]<1; "DONE";" " ) -> DONE
B12: of:=IF([.C12] < 80; "F";IF([.C12]>89; IF([.C12]>92;"A";"A-");IF([.C12]>82;"B";"B-"))) -> A | C12: of:=ROUND([.R12]*100/[.G12];0) -> 100 | D12: Job | E12: On-time | F12: 1 shift | G12: 9 | H12: 2 | I12: 0 | J12: 1 | K12: 1 | L12: 0 | M12: 0 | N12: 1 | O12: 0 | P12: 4 | Q12: 0 | R12: of:=SUM([.H12:.Q12]) -> 9 | S12: of:=IF([.G12]-[.R12]>0; [.G12]-[.R12]; 0) -> 0 | T12: of:=IF([.S12]<1; "DONE";" " ) -> DONE
B13: of:=IF([.C13] < 80; "F";IF([.C13]>89; IF([.C13]>92;"A";"A-");IF([.C13]>82;"B";"B-"))) -> A | C13: of:=ROUND([.R13]*100/[.G13];0) -> 100 | D13: Health | E13: Class | F13: 1 lesson | G13: 9 | H13: 1 | I13: 1 | J13: 1 | K13: 2 | L13: 0 | M13: 0 | N13: 1 | O13: 1 | P13: 0 | Q13: 2 | R13: of:=SUM([.H13:.Q13]) -> 9 | S13: of:=IF([.G13]-[.R13]>0; [.G13]-[.R13]; 0) -> 0 | T13: of:=IF([.S13]<1; "DONE";" " ) -> DONE
B14: of:=IF([.C14] < 80; "F";IF([.C14]>89; IF([.C14]>92;"A";"A-");IF([.C14]>82;"B";"B-"))) -> A | C14: of:=ROUND([.R14]*100/[.G14];0) -> 100 | D14: PE | E14: Exercise | F14: 30 min | G14: 27 | H14: 3 | I14: 3 | J14: 3 | K14: 3 | L14: 3 | M14: 3 | N14: 3 | O14: 1 | P14: 1 | Q14: 4 | R14: of:=SUM([.H14:.Q14]) -> 27 | S14: of:=IF([.G14]-[.R14]>0; [.G14]-[.R14]; 0) -> 0 | T14: of:=IF([.S14]<1; "DONE";" " ) -> DONE
B15: of:=IF([.C15] < 80; "F";IF([.C15]>89; IF([.C15]>92;"A";"A-");IF([.C15]>82;"B";"B-"))) -> A | C15: of:=ROUND([.R15]*100/[.G15];0) -> 100 | D15: English | E15: Meet w tutor | F15: 1 hr | G15: 9 | H15: 1 | I15: 1 | J15: 1 | K15: 1 | L15: 1 | M15: 1 | N15: 1 | O15: 1 | P15: 0 | Q15: 1 | R15: of:=SUM([.H15:.Q15]) -> 9 | S15: of:=IF([.G15]-[.R15]>0; [.G15]-[.R15]; 0) -> 0 | T15: of:=IF([.S15]<1; "DONE";" " ) -> DONE
B16: of:=IF([.C16] < 80; "F";IF([.C16]>89; IF([.C16]>92;"A";"A-");IF([.C16]>82;"B";"B-"))) -> A | C16: of:=ROUND([.R16]*100/[.G16];0) -> 100 | D16: SAT | E16: SAT test prep | F16: 1 lesson | G16: 9 | H16: 0 | I16: 0 | J16: 0 | K16: 0 | L16: 0 | M16: 1 | N16: 0 | O16: 0 | P16: 0 | Q16: 6 | R16: of:=SUM([.H16:.Q16]) -> 7 | S16: of:=IF([.G16]-[.R16]>0; [.G16]-[.R16]; 0) -> 0 | T16: of:=IF([.S16]<1; "DONE";" " ) -> DONE
B17: of:=IF([.C17] < 80; "F";IF([.C17]>89; IF([.C17]>92;"A";"A-");IF([.C17]>82;"B";"B-"))) -> A | C17: of:=ROUND([.R17]*100/[.G17];0) -> 100 | D17: English | E17: Writing | F17: 1 essay | G17: 9 | H17: 0 | I17: 0 | J17: 0 | K17: 0 | L17: 0 | M17: 0 | N17: 0 | O17: 0 | P17: 0 | Q17: 3 | R17: of:=SUM([.H17:.Q17]) -> 3 | S17: of:=IF([.G17]-[.R17]>0; [.G17]-[.R17]; 0) -> 0 | T17: of:=IF([.S17]<1; "DONE";" " ) -> DONE
B18: of:=IF([.C18] < 80; "F";IF([.C18]>89; IF([.C18]>92;"A";"A-");IF([.C18]>82;"B";"B-"))) -> A | C18: of:=ROUND([.R18]*100/[.G18];0) -> 100 | D18: English | E18: Grammar | F18: 1 edited essay | G18: 9 | H18: 1 | I18: 1 | J18: 0 | K18: 0 | L18: 0 | M18: 0 | N18: 0 | O18: 0 | P18: 0 | Q18: 7 | R18: of:=SUM([.H18:.Q18]) -> 9 | S18: of:=IF([.G18]-[.R18]>0; [.G18]-[.R18]; 0) -> 0 | T18: of:=IF([.S18]<1; "DONE";" " ) -> DONE
B19: of:=IF([.C19] < 80; "F";IF([.C19]>89; IF([.C19]>92;"A";"A-");IF([.C19]>82;"B";"B-"))) -> B | C19: of:=ROUND([.R19]*100/[.G19];0) -> 89 | D19: House | E19: Chores – Bedroom | F19: Clean/Vac | G19: 9 | H19: 1 | I19: 1 | J19: 1 | K19: 1 | L19: 0 | M19: 1 | N19: 0 | O19: 3 | P19: 0 | Q19: 0 | R19: of:=SUM([.H19:.Q19]) -> 8 | S19: of:=IF([.G19]-[.R19]>0; [.G19]-[.R19]; 0) -> 1 | T19: of:=IF([.S19]<1; "DONE";" " ) ->  
B20: of:=IF([.C20] < 80; "F";IF([.C20]>89; IF([.C20]>92;"A";"A-");IF([.C20]>82;"B";"B-"))) -> B | C20: of:=ROUND([.R20]*100/[.G20];0) -> 89 | D20: English | E20: Read Classic | F20: 100pg | G20: 9 | H20: 0 | I20: 1 | J20: 1 | K20: 1 | L20: 1 | M20: 1 | N20: 1 | O20: 0 | P20: 0 | Q20: 2 | R20: of:=SUM([.H20:.Q20]) -> 8 | S20: of:=IF([.G20]-[.R20]>0; [.G20]-[.R20]; 0) -> 1 | T20: of:=IF([.S20]<1; "DONE";" " ) ->  
B21: of:=IF([.C21] < 80; "F";IF([.C21]>89; IF([.C21]>92;"A";"A-");IF([.C21]>82;"B";"B-"))) -> B | C21: of:=ROUND([.R21]*100/[.G21];0) -> 88 | D21: Math | E21: Pre-calc | F21: % finished | G21: 18 | H21: 3 | I21: 0 | J21: 2 | K21: 0 | L21: 0 | M21: 5 | N21: 1 | O21: 2 | P21: 0 | Q21: 2 | R21: of:=SUM([.H21:.Q21]) -> 15 | S21: of:=IF([.G21]-[.R21]>0; [.G21]-[.R21]; 0) -> 2 | T21: of:=IF([.S21]<1; "DONE";" " ) ->  
B22: of:=IF([.C22] < 80; "F";IF([.C22]>89; IF([.C22]>92;"A";"A-");IF([.C22]>82;"B";"B-"))) -> F | C22: of:=ROUND([.R22]*100/[.G22];0) -> 56 | D22: English | E22: Essay Writing | F22: 1 lecture | G22: 9 | H22: 1 | I22: 0 | J22: 3 | K22: 0 | L22: 0 | M22: 0 | N22: 0 | O22: 0 | P22: 0 | Q22: 1 | R22: of:=SUM([.H22:.Q22]) -> 5 | S22: of:=IF([.G22]-[.R22]>0; [.G22]-[.R22]; 0) -> 4 | T22: of:=IF([.S22]<1; "DONE";" " ) ->  
B23: of:=IF([.C23] < 80; "F";IF([.C23]>89; IF([.C23]>92;"A";"A-");IF([.C23]>82;"B";"B-"))) -> F | C23: of:=ROUND([.R23]*100/[.G23];0) -> 64 | D23: Bio | E23: AP Bio Lab | F23: 1 lab/write up | G23: 11 | H23: 2 | I23: 0 | J23: 1 | K23: 2 | L23: 0 | M23: 0 | N23: 0 | O23: 0 | P23: 0 | Q23: 2 | R23: of:=SUM([.H23:.Q23]) -> 7 | S23: of:=IF([.G23]-[.R23]>0; [.G23]-[.R23]; 0) -> 4 | T23: of:=IF([.S23]<1; "DONE";" " ) ->  
C24: of:=ROUND([.R24]*100/[.G24];0) -> 94 | D24: TOTAL | G24: of:=SUM([.G5:.G23]) -> 190 | H24: of:=SUM([.H5:.H23]) -> 20 | I24: of:=SUM([.I5:.I23]) -> 13 | J24: of:=SUM([.J5:.J23]) -> 21 | K24: of:=SUM([.K5:.K23]) -> 20 | L24: of:=SUM([.L5:.L23]) -> 15 | M24: of:=SUM([.M5:.M23]) -> 17 | N24: of:=SUM([.N5:.N23]) -> 25 | O24: of:=SUM([.O5:.O23]) -> 12 | P24: of:=SUM([.P5:.P23]) -> 5 | Q24: of:=SUM([.Q5:.Q23]) -> 30 | R24: of:=SUM([.H24:.Q24]) -> 178 | S24: of:=[.G24] - [.R24] -> 12

Sheet: Sample Dashboard
A1: Student Dashboard | I1: of:=TODAY() -> 2023-03-30
B2: of:=['Sample Student Checklist'.$B$2] -> 12th Grade, 1st Quarter
C3: Week of the Quarter
C4: Start | D4: of:=[$'Sample Student Checklist'.H$4] -> W1 | E4: of:=[$'Sample Student Checklist'.I$4] -> W2 | F4: of:=[$'Sample Student Checklist'.J$4] -> W3 | G4: of:=[$'Sample Student Checklist'.K$4] -> W4 | H4: of:=[$'Sample Student Checklist'.L$4] -> W5 | I4: of:=[$'Sample Student Checklist'.M$4] -> W6 | J4: of:=[$'Sample Student Checklist'.N$4] -> W7 | K4: of:=[$'Sample Student Checklist'.O$4] -> W8 | L4: of:=[$'Sample Student Checklist'.P$4] -> W9 | M4: of:=[$'Sample Student Checklist'.Q$4] -> W10
B5: Benchmark | C5: 0 | D5: of:=ROUND(1*100/10;0) -> 10 | E5: of:=ROUND(2*100/10;0) -> 20 | F5: of:=ROUND(3*100/10;0) -> 30 | G5: of:=ROUND(4*100/10;0) -> 40 | H5: of:=ROUND(5*100/10;0) -> 50 | I5: of:=ROUND(6*100/10;0) -> 60 | J5: of:=ROUND(7*100/10;0) -> 70 | K5: of:=ROUND(8*100/10;0) -> 80 | L5: of:=ROUND(9*100/10;0) -> 90 | M5: of:=ROUND(10*100/10;0) -> 100
B6: Progress | C6: 0 | D6: of:=ROUND(SUM([$'Sample Student Checklist'.$H24:$'Sample Student Checklist'.H24])/[$'Sample Student Checklist'.$G$24]; 2) * 100 -> 11 | E6: of:=ROUND(SUM([$'Sample Student Checklist'.$H24:$'Sample Student Checklist'.I24])/[$'Sample Student Checklist'.$G$24]; 2) * 100 -> 17 | F6: of:=ROUND(SUM([$'Sample Student Checklist'.$H24:$'Sample Student Checklist'.J24])/[$'Sample Student Checklist'.$G$24]; 2) * 100 -> 28 | G6: of:=ROUND(SUM([$'Sample Student Checklist'.$H24:$'Sample Student Checklist'.K24])/[$'Sample Student Checklist'.$G$24]; 2) * 100 -> 39 | H6: of:=ROUND(SUM([$'Sample Student Checklist'.$H24:$'Sample Student Checklist'.L24])/[$'Sample Student Checklist'.$G$24]; 2) * 100 -> 47 | I6: of:=ROUND(SUM([$'Sample Student Checklist'.$H24:$'Sample Student Checklist'.M24])/[$'Sample Student Checklist'.$G$24]; 2) * 100 -> 56 | J6: of:=ROUND(SUM([$'Sample Student Checklist'.$H24:$'Sample Student Checklist'.N24])/[$'Sample Student Checklist'.$G$24]; 2) * 100 -> 69 | K6: of:=ROUND(SUM([$'Sample Student Checklist'.$H24:$'Sample Student Checklist'.O24])/[$'Sample Student Checklist'.$G$24]; 2) * 100 -> 75 | L6: of:=ROUND(SUM([$'Sample Student Checklist'.$H24:$'Sample Student Checklist'.P24])/[$'Sample Student Checklist'.$G$24]; 2) * 100 -> 78 | M6: of:=ROUND(SUM([$'Sample Student Checklist'.$H24:$'Sample Student Checklist'.Q24])/[$'Sample Student Checklist'.$G$24]; 2) * 100 -> 94

Sheet: Grading
A1: Grade Ranges
B3: Letter Grade | C3: Lowest Number | D3: Highest Number | E3: Range
B4: A | C4: 93 | D4: 100 | E4: of:=CONCATENATE(TEXT([.$C4];"00");"-";TEXT([.$D4];"00")) -> 93-100
B5: A- | C5: 90 | D5: 92 | E5: of:=CONCATENATE(TEXT([.$C5];"00"); "-"; TEXT([.$D5];"00")) -> 90-92
B6: B | C6: 83 | D6: 89 | E6: of:=CONCATENATE(TEXT([.$C6];"00");"-";TEXT([.$D6];"00")) -> 83-89
B7: B- | C7: 80 | D7: 82 | E7: of:=CONCATENATE(TEXT([.$C7];"00");"-";TEXT([.$D7];"00")) -> 80-82
B8: F | C8: 0 | D8: 79 | E8: of:=CONCATENATE(TEXT([.$C8];"00");"-";TEXT([.$D8];"00")) -> 00-79
B10: These grades differ from the grades in most schools because they are completion-based. Each student is graded on the percentage of completed goals for the quarter.